{
  "baseline_commit": "0cf7b006eba665c0bf55e82ff04da70f19f01ebb",
  "baseline_tree": "70c5cf8352652b3c4c1dce68cd1a5e40d44e4b05",
  "evidence": {
    "independent_review": {
      "path": "raw/internal/migrations/2026-07-13-135-echo-context-review.md",
      "sha256": "0125d26b2192a4bacbfa347c25fa592a5255a37aced46cc09877e639b5dcfa60"
    },
    "migration_record": {
      "path": "raw/internal/migrations/2026-07-13-135-echo-context.md",
      "sha256": "eed83d4ad6d6706a3b2b1a454716f4344016481ba6108257b9f46f9055b0cc28"
    }
  },
  "inventory_sha256": "42b2d813008bbba96d7c325a6aead38fd755e6488a66615aa99303f3ba6be58a",
  "path_count": 190,
  "paths": [
    {
      "blob_oid": "4c8ebfd3d6fdba768735f8fdc002593ac204308f",
      "content_sha256": "9fea2b1886cca66fcfbc8dcf241a287075b6bee68328af16300eeee196df138f",
      "mode": "100644",
      "path": "README.md",
      "size": 3058
    },
    {
      "blob_oid": "998163099911f291583a514b04f1c604a6cbad13",
      "content_sha256": "db6eab7d3046f6925ac9a58bf4ff13bf321547c2b74903acde71821f4c09ce37",
      "mode": "100644",
      "path": "context-tools.v1.json",
      "size": 436
    },
    {
      "blob_oid": "f7a3a7954398946755ffe01e816bf49deff4a26f",
      "content_sha256": "4c5639f08feb5d64a7659e154fbe9c0f4f44deaa5c91ff5f1edee8aacf8568e5",
      "mode": "100644",
      "path": "package-lock.json",
      "size": 162813
    },
    {
      "blob_oid": "96b518003ac56fa2bcdd483b183921bf6b87250a",
      "content_sha256": "99efa7b4bd754cf5b6794267da136aa85820577e7ec53d619a91c7127fcb8ce2",
      "mode": "100644",
      "path": "package.json",
      "size": 1111
    },
    {
      "blob_oid": "3c01a82f7ab71075edf8a86d064cbbc3bdc01a78",
      "content_sha256": "0c9662184b7b234c1c72fc1a814c14d57e775d6d8d5ec51bfd5fbe3f5397b02a",
      "mode": "100644",
      "path": "provenance/context-tool-parity.v1.json",
      "size": 146918
    },
    {
      "blob_oid": "062eb6caa79bd89fbf0516860914299b73edea37",
      "content_sha256": "be8f50ec9be562201616845a47e5990722cd1aaeb0140104a474067178b58151",
      "mode": "100644",
      "path": "provenance/lifecycle-expected.v1.json",
      "size": 2132
    },
    {
      "blob_oid": "600af22dd174c27f332a11669d5f595609aa9f23",
      "content_sha256": "ed3b7eb844239a98e83189462cdfe3beedc07e06f02ac93c716f5c3d19135697",
      "mode": "100644",
      "path": "provenance/lifecycle-observed.v1.json",
      "size": 1278
    },
    {
      "blob_oid": "3e583e4f0b665fb90d46422b0db9f947792153cc",
      "content_sha256": "4341f8703999c60c570c89c34abe7d6955477477aac4c743afba740dab9b5c7d",
      "mode": "100644",
      "path": "provenance/native-toolchain.v1.json",
      "size": 591
    },
    {
      "blob_oid": "6bd7dcdd1ee954baf6650f0ac2ffb94f96c2e328",
      "content_sha256": "7e847de868b6747660e671c3330f47b255b31f8e68c7abc2586351135c70b103",
      "mode": "100644",
      "path": "provenance/parity-matrix.v1.json",
      "size": 118611
    },
    {
      "blob_oid": "d88a5f2d929dbf8c5e6aaa9c2398f9863dfac6d4",
      "content_sha256": "29512b101dc672aec83102f147b60c04dd694b1602479024299b228becf95caf",
      "mode": "100644",
      "path": "provenance/runtime-inventory.v1.json",
      "size": 183142
    },
    {
      "blob_oid": "2cc10a381df83e2b0e4b6c65b49b1390ca7c7960",
      "content_sha256": "5cd0c084f70aeab7a59e5dfc97c16bebf728ff1d1ab85485454704960a7f436b",
      "mode": "100644",
      "path": "provenance/schemas/context-tool-parity.v1.schema.json",
      "size": 11930
    },
    {
      "blob_oid": "f4016a7a9a44042c042590f88e8130893213c06b",
      "content_sha256": "1a2eeff933d8f8dbdb66c18141b8a786496fe29132e6d17f24790c788c7fdae2",
      "mode": "100644",
      "path": "provenance/schemas/lifecycle-expected.v1.schema.json",
      "size": 916
    },
    {
      "blob_oid": "c1584bb33a1955e6feff705e5d69558bd1d2de14",
      "content_sha256": "63e345c9d1afc1fc7ae77a07ac0d7f46c4b0294f0ddb88c79ee211b7385254cf",
      "mode": "100644",
      "path": "provenance/schemas/lifecycle-observed.v1.schema.json",
      "size": 561
    },
    {
      "blob_oid": "6000c8da28354613806b2fdb3b85743ea33cc46b",
      "content_sha256": "3a19d84dee828926df17fcc45c61183b90116273e5dd6541f1f39e158fc5f0fc",
      "mode": "100644",
      "path": "provenance/schemas/native-toolchain.v1.schema.json",
      "size": 932
    },
    {
      "blob_oid": "6c453054b202bb58870eca2a17df66ae34a3e023",
      "content_sha256": "0e87797f0b9d2a8f318d0e7ee7ad1da66194269e443d47665f60da8eb211efdb",
      "mode": "100644",
      "path": "provenance/schemas/parity-matrix.v1.schema.json",
      "size": 4370
    },
    {
      "blob_oid": "2665b18665d6269452df5d8cff1fd2f5dbd53e17",
      "content_sha256": "537819a7f209225062c385a10e8b02a5dca33c5272375cd35565de5bfc02a57e",
      "mode": "100644",
      "path": "provenance/schemas/runtime-inventory.v1.schema.json",
      "size": 4141
    },
    {
      "blob_oid": "b8cae919a59d58c43bb713d8fe16981f71714834",
      "content_sha256": "e29d0b865fc83524784c829012ccd3f9961a632b84fdfea9fc92b21ad31aeb30",
      "mode": "100644",
      "path": "provenance/schemas/source-evidence.v1.schema.json",
      "size": 1323
    },
    {
      "blob_oid": "608a6475c255687dd94ab49137b1e40aae98fc6a",
      "content_sha256": "e959cc880b2a811d9013b96ba6449c5e8eeb322bddab48abffe051ac1746fec4",
      "mode": "100644",
      "path": "provenance/schemas/source-extraction.v1.schema.json",
      "size": 1752
    },
    {
      "blob_oid": "10da3959fb280dbd37fc21f901c5f4f577202772",
      "content_sha256": "25348d79dc8229cffa30a1f1216206e3f58a0d12201c5fd72b07cd01be07a7b6",
      "mode": "100644",
      "path": "provenance/schemas/target-only-policy.v1.schema.json",
      "size": 496
    },
    {
      "blob_oid": "4c4a1a93b9ff0b0216f709ea62becf72b68ee321",
      "content_sha256": "bc3094d81b47f22ff27422644b40893eb3f5a050c12e3aa5d049b40394fc6279",
      "mode": "100644",
      "path": "provenance/source-evidence.v1.json",
      "size": 52557
    },
    {
      "blob_oid": "cfaa66fd0c807514d1ce01f7857018cc168c602a",
      "content_sha256": "be79e3a9e7a593cc35913ea79d414ab3caeb64a3b87cf676e15421f3759c0565",
      "mode": "100644",
      "path": "provenance/source-extraction.v1.json",
      "size": 41176
    },
    {
      "blob_oid": "ffe3d060b30955b8dd8a31c68e0b7cc609474026",
      "content_sha256": "4f075fcaee338aaf66a79bb61c95200ff2802d470d7bac2383e577159705df77",
      "mode": "100644",
      "path": "provenance/target-only-policy.v1.json",
      "size": 2095
    },
    {
      "blob_oid": "b5006235280edc1a048501e74be7bc0d96e502e7",
      "content_sha256": "4f24e7af1ab98874204df76a3901b3d5b2fa09f2bc0298d84ac80b354d3bd13f",
      "mode": "100644",
      "path": "schemas/service-api.v1.json",
      "size": 19564
    },
    {
      "blob_oid": "8b4f418686bab4393b2e76c324d904a26a9f7672",
      "content_sha256": "8516dadaca3b234291aedd32b5ee273df43bc17346eaafd96aa8b8b7cd9ab7da",
      "mode": "100644",
      "path": "src/capture/extractors/_shared.ts",
      "size": 7174
    },
    {
      "blob_oid": "9cfacb226d5e48d234f64e33593e0e3a5cd92c85",
      "content_sha256": "a03a3f7f25bc2eb56653d97b92f9bfb29feebb7813313d04983be01b56ed95ed",
      "mode": "100644",
      "path": "src/capture/extractors/_turn_meta.ts",
      "size": 3836
    },
    {
      "blob_oid": "765738abd3d717ce7ab4c77019e0d171f5db9f3b",
      "content_sha256": "2cc487f9c73aa50c00f0ff446b50e694b0d9f4628207bc1839a5d9bffabbd503",
      "mode": "100644",
      "path": "src/capture/extractors/claude-code.ts",
      "size": 23820
    },
    {
      "blob_oid": "e3c09e5df27cb1e77429f79f86c077f794135ffa",
      "content_sha256": "80628c0b422b0d4ea006a64da0a874307ef8a29c74c9ef6eaee23a1078fa7755",
      "mode": "100644",
      "path": "src/capture/extractors/codex.ts",
      "size": 30601
    },
    {
      "blob_oid": "7e1fd9bba47c643701e93d26674262906fbbe548",
      "content_sha256": "cccb31853b8f70e357a96741eceffe42d89ff443ca8013e86d31ac838df4a835",
      "mode": "100644",
      "path": "src/capture/extractors/cursor.ts",
      "size": 58480
    },
    {
      "blob_oid": "4b54ca9f625715f4a55123718e589f5d0e33203e",
      "content_sha256": "fedbf25838dc8ba9348e8b28c4fe4edb862175919fbf87f7693e9d65f620ca88",
      "mode": "100644",
      "path": "src/capture/gate.ts",
      "size": 2945
    },
    {
      "blob_oid": "9a1babc973dee13cec416bb70ac2f5e384c64f91",
      "content_sha256": "4498f85ca9ea6267158e93a1b50c64300c513294816a4a26d30ea975e818df2e",
      "mode": "100644",
      "path": "src/capture/git-state.ts",
      "size": 5819
    },
    {
      "blob_oid": "8664706bde86785fad87f525a6cfbc6bafb9610b",
      "content_sha256": "a2d2ad902920f21ab52a41c3f895aa82efeab7488a5d4e6ffdfcb06e44ea1990",
      "mode": "100644",
      "path": "src/capture/granola-source-policy.ts",
      "size": 927
    },
    {
      "blob_oid": "dfa2bb254be7924bcd4cd66ad1111095494fe577",
      "content_sha256": "796d4552723ad1c9e09efa6de9c01716ec2eac810056eb0e47eb306d94fdfa06",
      "mode": "100644",
      "path": "src/capture/pipeline-core.ts",
      "size": 3250
    },
    {
      "blob_oid": "ba588cf54ae132e5de8dfcc4668e0281e4ac0da8",
      "content_sha256": "5f5b340847d70c3b126c3e73084674fa1b92ab303b7e71104c9b03ea44cfeb87",
      "mode": "100644",
      "path": "src/capture/pipeline.ts",
      "size": 1093
    },
    {
      "blob_oid": "f2af9a18271f470beed4c09fd2b425947c455f08",
      "content_sha256": "2e86eb8dfe57399308b646d3b12c1e2b8f8ece132389821b9a56499ccf027826",
      "mode": "100644",
      "path": "src/capture/sources.ts",
      "size": 7336
    },
    {
      "blob_oid": "fb648e121f573e3a121618bb38b347e4d82b4442",
      "content_sha256": "f6e8ab8f23becf3b8b5808020f1dd0c774ae05fbe7733a57d14ad32a0bbb2c7b",
      "mode": "100644",
      "path": "src/capture/surfaces/fs-watcher.ts",
      "size": 4171
    },
    {
      "blob_oid": "31ddb70edafae82ee277552a3107b0316fc0caa9",